title,plot
Taken,A retired CIA operative uses his skills to rescue his kidnapped daughter in Paris.
Mission: Impossible – Fallout,"Ethan Hunt and his team race against time after a mission goes wrong, with high-stakes chases through Paris."
The Bourne Identity,A man with amnesia tries to discover his true identity while being pursued by assassins in Europe.
Amélie,A whimsical Parisian woman decides to change the lives of those around her for the better.
Skyfall,Bond investigates an attack on MI6 as secrets from M's past come back to haunt her.

